{
  "tree_id": "ATOM-TMP.SAI.001-06",
  "kind": "atomic",
  "version": 1,
  "language": "fr",
  "age_band": "N1",
  "age_range": "3-4",
  "title": "Les saisons de Florent",
  "lesson_id": "TMP.SAI.001",
  "secondary_lessons": [],
  "domain": "TMP",
  "subdomain": "TMP.SAI",
  "framing": "standard",
  "sensitivity": "standard",
  "family_model": "father_mother_children",
  "setting": "chemin vers l'école",
  "characters": [
    "Florent",
    "maman",
    "papa"
  ],
  "root_id": "n1",
  "duration_estimate_seconds": {
    "min": 90,
    "avg": 125,
    "max": 160
  },
  "nodes": {
    "n1": {
      "id": "n1",
      "type": "audio",
      "text": "Florent marche vers l'école. Maman tient sa main. Papa a mis le manteau dans le sac. Ils passent sous un grand arbre. Maman dit : il y a quatre saisons. Au printemps, Florent voit des fleurs. En été, il fait chaud. Florent boit de l'eau. En automne, les feuilles tombent. Elles sont jaunes. En hiver, Florent met son manteau. Maman dit un signe chacune. Fleurs, chaud, feuilles, manteau. Florent répète : quatre saisons. Papa arrive au portail. Il dit : quatre saisons.",
      "next": "n2"
    },
    "n2": {
      "id": "n2",
      "type": "question_lesson",
      "prompt": "Il fait chaud. Quelle saison est-ce ?",
      "expected_intents": [
        "SAISON"
      ],
      "accepted_examples": [
        "été",
        "l'été",
        "en été"
      ],
      "retry_prompt": "En été, il fait chaud. Quelle saison ?",
      "positive_feedback": "Oui. Quatre saisons. Un signe chacune.",
      "wrong_feedback": "Il y a quatre saisons. Printemps, été, automne, hiver. Un signe chacune.",
      "default_next": "n3",
      "next": "n3"
    },
    "n3": {
      "id": "n3",
      "type": "feedback",
      "text": "Florent a nommé les quatre saisons. Un signe chacune. Maman l'a aidé.",
      "next": "n4"
    },
    "n4": {
      "id": "n4",
      "type": "ending",
      "text": "Florent ramasse une feuille. Maman tient sa main. L'histoire est finie."
    }
  },
  "validation": {
    "status": "APPROVED_TEXT",
    "blocking_findings": 0,
    "major_findings": 0,
    "paths_tested": 1
  }
}
