{
  "tree_id": "ATOM-JEU.FOOT.001-01",
  "kind": "atomic",
  "version": 1,
  "language": "fr",
  "age_band": "N2",
  "age_range": "4-5",
  "title": "Le petit foot d'Adam",
  "lesson_id": "JEU.FOOT.001",
  "secondary_lessons": [],
  "domain": "JEU",
  "subdomain": "JEU.BAL",
  "framing": "standard",
  "sensitivity": "standard",
  "family_model": "father_mother_children",
  "setting": "parc",
  "characters": [
    "Adam",
    "papa"
  ],
  "root_id": "n1",
  "duration_estimate_seconds": {
    "min": 120,
    "avg": 175,
    "max": 230
  },
  "nodes": {
    "n1": {
      "id": "n1",
      "type": "audio",
      "text": "Adam et papa arrivent au parc. L'herbe sent l'été. Papa pose deux gourdes. Il trace un petit rectangle. Papa dit : voici l'espace montré. On reste dans l'espace montré. Au fond, papa pose deux sacs. C'est le but. Adam touche le ballon du pied. Le ballon est souple. Papa dit : on va passer le ballon. Puis on vise le but. Adam passe le ballon à papa. Papa le rend. Adam pousse le ballon vers le but. Le ballon roule entre les sacs. Adam lève les bras. Papa dit : on reste dans le rectangle. Adam ramène le ballon. Il passe encore. Il vise encore le but. Les pieds restent dans l'espace montré par papa.",
      "next": "n2"
    },
    "n2": {
      "id": "n2",
      "type": "question_lesson",
      "prompt": "Adam joue au foot. Que fait-il ?",
      "expected_intents": [
        "BUT",
        "PASSER"
      ],
      "accepted_examples": [
        "le but",
        "au but",
        "passer",
        "il passe"
      ],
      "retry_prompt": "Il envoie le ballon au fond. Vers quoi ?",
      "positive_feedback": "Oui. Il passe le ballon. Il vise le but. Dans l'espace montré.",
      "wrong_feedback": "On va passer le ballon. On vise le but. On reste dans l'espace montré par papa ou maman.",
      "default_next": "n3",
      "next": "n3"
    },
    "n3": {
      "id": "n3",
      "type": "feedback",
      "text": "Adam a passé le ballon. Il a visé le but. Il est resté dans l'espace montré par papa.",
      "next": "n4"
    },
    "n4": {
      "id": "n4",
      "type": "ending",
      "text": "Papa range les sacs. Adam boit une gorgée. Ils marchent vers la maison. L'histoire est finie."
    }
  },
  "validation": {
    "status": "APPROVED_TEXT",
    "blocking_findings": 0,
    "major_findings": 0,
    "paths_tested": 1
  }
}
