{
  "tree_id": "ATOM-SOC.MET.001-02",
  "kind": "atomic",
  "version": 1,
  "language": "fr",
  "age_band": "N2",
  "age_range": "4-5",
  "title": "Les métiers de Sara",
  "lesson_id": "SOC.MET.001",
  "secondary_lessons": [],
  "domain": "SOC",
  "subdomain": "SOC.MET",
  "framing": "standard",
  "sensitivity": "standard",
  "family_model": "father_mother_children",
  "setting": "bus, boulangerie, chez le médecin, école",
  "characters": [
    "Sara",
    "papa"
  ],
  "root_id": "n1",
  "duration_estimate_seconds": {
    "min": 120,
    "avg": 180,
    "max": 230
  },
  "nodes": {
    "n1": {
      "id": "n1",
      "type": "audio",
      "text": "Sara monte dans le bus avec papa. Le chauffeur ouvre la porte. Papa dit : c'est un métier. Le chauffeur fait un geste utile. Il conduit. Sara dit : chauffeur. Ils descendent. Ça sent le pain chaud. Le boulanger pose les brioches. Papa dit : c'est un métier. Le boulanger fait un geste utile. Il prépare le pain. Sara dit : boulanger. Plus tard, ils passent chez le médecin. Le médecin écoute le cœur. C'est un métier. Un geste utile. Il soigne. À l'école, la maîtresse lit. C'est un métier. Un geste utile. Elle aide les enfants. Sara nomme chaque métier. Parce qu'elle nomme, elle comprend le geste.",
      "next": "n2"
    },
    "n2": {
      "id": "n2",
      "type": "question_lesson",
      "prompt": "Le chauffeur conduit le bus. C'est quoi ?",
      "expected_intents": [
        "METIER"
      ],
      "accepted_examples": [
        "un métier",
        "métier",
        "chauffeur",
        "le chauffeur"
      ],
      "retry_prompt": "Il fait un geste utile. C'est quoi ?",
      "positive_feedback": "Oui. C'est un métier. Un geste utile.",
      "wrong_feedback": "On nomme le métier. Boulanger, médecin, maîtresse ou chauffeur.",
      "default_next": "n3",
      "next": "n3"
    },
    "n3": {
      "id": "n3",
      "type": "feedback",
      "text": "Sara a nommé les métiers. Chauffeur. Boulanger. Médecin. Maîtresse. Chaque geste est utile.",
      "next": "n4"
    },
    "n4": {
      "id": "n4",
      "type": "ending",
      "text": "Sara serre la main de papa. Ils rentrent à la maison. L'histoire est finie."
    }
  },
  "validation": {
    "status": "APPROVED_TEXT",
    "blocking_findings": 0,
    "major_findings": 0,
    "paths_tested": 1
  }
}
