{
  "tree_id": "ATOM-SAN.SOM.001-01",
  "kind": "atomic",
  "version": 1,
  "language": "fr",
  "age_band": "N1",
  "age_range": "3-4",
  "title": "Le pyjama d'Inès",
  "lesson_id": "SAN.SOM.001",
  "secondary_lessons": [],
  "domain": "SAN",
  "subdomain": "SAN.SOM",
  "framing": "standard",
  "sensitivity": "standard",
  "family_model": "father_mother_children",
  "setting": "chambre",
  "characters": [
    "Inès",
    "maman",
    "papa"
  ],
  "root_id": "n1",
  "duration_estimate_seconds": {
    "min": 90,
    "avg": 120,
    "max": 150
  },
  "nodes": {
    "n1": {
      "id": "n1",
      "type": "audio",
      "text": "Le soir, la maison est calme. Maman dit : c'est l'heure. Inès met son pyjama. Le pyjama est doux. Papa ouvre le lit. Inès se couche. Elle pose la tête sur l'oreiller. Papa raconte une petite histoire. Inès écoute. Elle ferme les yeux. C'est l'heure du dodo. Maman dit : le corps a besoin de dormir. Inès respire doucement. Papa baisse la lumière. Inès est au lit. C'est le dodo.",
      "next": "n2"
    },
    "n2": {
      "id": "n2",
      "type": "question_lesson",
      "prompt": "Inès va dormir. Que met-elle ?",
      "expected_intents": [
        "PYJAMA",
        "LIT"
      ],
      "accepted_examples": [
        "pyjama",
        "le pyjama",
        "au lit",
        "le lit",
        "elle se couche"
      ],
      "retry_prompt": "Elle met le pyjama. Puis elle va au lit. Que fait Inès ?",
      "positive_feedback": "Oui. Inès met son pyjama. Elle se couche dans le lit.",
      "wrong_feedback": "Le soir, on met le pyjama. On se couche dans le lit.",
      "default_next": "n3",
      "next": "n3"
    },
    "n3": {
      "id": "n3",
      "type": "feedback",
      "text": "Inès a mis le pyjama. Elle s'est couchée. Le soir, c'est le dodo. Papa et maman sont là.",
      "next": "n4"
    },
    "n4": {
      "id": "n4",
      "type": "ending",
      "text": "Inès dort. Le pyjama est chaud. La chambre est calme. L'histoire est finie."
    }
  },
  "validation": {
    "status": "APPROVED_TEXT",
    "blocking_findings": 0,
    "major_findings": 0,
    "paths_tested": 1
  }
}
