{
  "tree_id": "ATOM-EMO.LEX.005-02",
  "kind": "atomic",
  "version": 1,
  "language": "fr",
  "age_band": "N3",
  "age_range": "5-6",
  "title": "Être en colère",
  "lesson_id": "EMO.LEX.005",
  "secondary_lessons": [],
  "domain": "EMO",
  "subdomain": "EMO.LEX",
  "framing": "emotional",
  "sensitivity": "standard",
  "family_model": "father_mother_children",
  "setting": "parc",
  "characters": [
    "Zoé",
    "papa"
  ],
  "root_id": "n1",
  "duration_estimate_seconds": {
    "min": 150,
    "avg": 195,
    "max": 240
  },
  "nodes": {
    "n1": {
      "id": "n1",
      "type": "audio",
      "text": "Zoé est au parc avec papa. Elle sculpte un château dans le bac à sable. Un ballon roule tout près. Le château s'affaisse d'un coup. Zoé sent son visage brûler. Ses mains deviennent chaudes et dures. Zoé dit : je suis en colère. Elle ouvre les doigts. Elle garde les mains loin de l'autre enfant. Zoé peut s'éloigner. Elle s'éloigne du bac à sable. Elle va sous le tilleul. Elle souffle quatre fois, lentement. Puis elle marche vers papa. Papa est l'adulte assis au banc. Zoé dit : papa, je suis en colère. Le château est tombé. Papa écoute. Zoé reste près de lui. Plus tard, elles refont un petit tas. La colère a un nom. Les mains restent loin. On s'éloigne. On va vers un adulte.",
      "next": "n2"
    },
    "n2": {
      "id": "n2",
      "type": "question_lesson",
      "prompt": "Le château de Zoé s'affaisse. Que fait-elle de sa colère ?",
      "expected_intents": [
        "COLERE",
        "ELOIGNER",
        "ADULTE"
      ],
      "accepted_examples": [
        "s'éloigner",
        "vers papa",
        "adulte",
        "mains loin",
        "souffler"
      ],
      "retry_prompt": "Zoé nomme sa colère. Puis elle va où ?",
      "positive_feedback": "Oui. Zoé nomme sa colère. Mains loin. Elle peut s'éloigner. Elle va vers un adulte.",
      "wrong_feedback": "On dit : je suis en colère. Les mains restent loin. On peut s'éloigner. On va vers un adulte.",
      "default_next": "n3",
      "next": "n3"
    },
    "n3": {
      "id": "n3",
      "type": "feedback",
      "text": "Zoé a nommé sa colère au parc. Mains loin. Elle peut s'éloigner. Elle rejoint papa, l'adulte.",
      "next": "n4"
    },
    "n4": {
      "id": "n4",
      "type": "ending",
      "text": "Zoé pose une coquille sur le petit tas. Papa reste au banc. L'histoire est finie."
    }
  },
  "validation": {
    "status": "APPROVED_TEXT",
    "blocking_findings": 0,
    "major_findings": 0,
    "paths_tested": 1
  }
}
