{
  "tree_id": "ATOM-FAM.SEC.001-07",
  "kind": "atomic",
  "version": 1,
  "language": "fr",
  "age_band": "N3",
  "age_range": "5-6",
  "title": "Didier garde la surprise gentille",
  "lesson_id": "FAM.SEC.001",
  "secondary_lessons": [],
  "domain": "FAM",
  "subdomain": "FAM.SEC",
  "framing": "standard",
  "sensitivity": "standard",
  "family_model": "father_mother_children",
  "setting": "cuisine",
  "characters": [
    "Didier",
    "maman",
    "papa"
  ],
  "root_id": "n1",
  "duration_estimate_seconds": {
    "min": 130,
    "avg": 185,
    "max": 235
  },
  "nodes": {
    "n1": {
      "id": "n1",
      "type": "audio",
      "text": "C'est bientôt l'anniversaire de papa. Maman sort un gâteau au citron. Elle dit : c'est une surprise gentille. On la garde un peu. Didier sent le citron. Il a envie de parler. Maman dit : on garde un peu. Puis on dit. Didier hoche la tête. Papa rentre. Didier serre les lèvres. Il sourit. La surprise gentille reste encore. Plus tard, maman pose le gâteau sur la table. Didier dit : c'est pour toi, papa. Puis on dit. Papa ouvre les yeux. Il rit. Didier dit : c'était une surprise gentille. On l'a gardée un peu. Puis on a dit. Papa serre Didier. Le gâteau sent le citron. Même leçon : une surprise gentille se garde un peu, puis on dit.",
      "next": "n2"
    },
    "n2": {
      "id": "n2",
      "type": "question_lesson",
      "prompt": "Didier a une surprise gentille. Que fait-on ?",
      "expected_intents": [
        "SURPRISE_GENTILLE"
      ],
      "accepted_examples": [
        "surprise gentille",
        "on garde un peu",
        "puis on dit",
        "on dit"
      ],
      "retry_prompt": "On la garde un peu. Puis on dit. Que fait Didier ?",
      "positive_feedback": "Oui. C'est une surprise gentille. On la garde un peu, puis on dit.",
      "wrong_feedback": "Une surprise gentille se garde un peu. Puis on dit à papa ou maman.",
      "default_next": "n3",
      "next": "n3",
      "lesson_id": "FAM.SEC.001"
    },
    "n3": {
      "id": "n3",
      "type": "feedback",
      "text": "Didier a gardé la surprise gentille. Puis on a dit. Papa a souri.",
      "next": "n4"
    },
    "n4": {
      "id": "n4",
      "type": "ending",
      "text": "Didier goûte une miette. Le citron est doux. L'histoire est finie."
    }
  },
  "validation": {
    "status": "APPROVED_TEXT",
    "blocking_findings": 0,
    "notes": "générateur, revue humaine requise",
    "major_findings": 0,
    "paths_tested": 1
  }
}
