{
  "tree_id": "ATOM-SOC.CUI.001-02",
  "kind": "atomic",
  "version": 1,
  "language": "fr",
  "age_band": "N2",
  "age_range": "4-5",
  "title": "Ava prépare le dîner avec papa",
  "lesson_id": "SOC.CUI.001",
  "secondary_lessons": [],
  "domain": "SOC",
  "subdomain": "SOC.CUI",
  "framing": "standard",
  "sensitivity": "standard",
  "family_model": "father_mother_children",
  "setting": "cuisine",
  "characters": [
    "Ava",
    "papa"
  ],
  "root_id": "n1",
  "duration_estimate_seconds": {
    "min": 120,
    "avg": 175,
    "max": 230
  },
  "nodes": {
    "n1": {
      "id": "n1",
      "type": "audio",
      "text": "Le soir, Ava entre dans la cuisine. Papa met la nappe. Ava dit : je peux aider ? Papa dit : oui. Une tâche sûre, avec un adulte. Papa, c'est l'adulte. Ava ouvre le robinet. Elle lave une tomate rouge. L'eau coule. La peau brille. Alors la tomate est propre. Ava l'essuie. Papa pose les assiettes. Ava prend une cuillère. Elle pose la cuillère près de chaque assiette. Alors chacun a sa cuillère. Ava va au panier. Elle apporte le pain. Elle le pose au milieu. Alors le pain est à table. Papa dit : merci. Laver, poser, apporter. Ava reste près de papa. Ensemble, ils appellent maman.",
      "next": "n2"
    },
    "n2": {
      "id": "n2",
      "type": "question_lesson",
      "prompt": "Ava prépare avec papa. Que fait-elle ?",
      "expected_intents": [
        "AIDER",
        "AVEC_ADULTE"
      ],
      "accepted_examples": [
        "aider",
        "laver",
        "poser",
        "avec papa"
      ],
      "retry_prompt": "Elle pose la cuillère. Que fait Ava ?",
      "positive_feedback": "Oui. Elle aide avec une tâche sûre, avec papa.",
      "wrong_feedback": "On aide avec une tâche sûre, avec papa ou maman. Laver, poser, apporter.",
      "default_next": "n3",
      "next": "n3"
    },
    "n3": {
      "id": "n3",
      "type": "feedback",
      "text": "Ava a lavé la tomate. Elle a posé les cuillères. Elle a apporté le pain. Avec papa. Une tâche sûre.",
      "next": "n4"
    },
    "n4": {
      "id": "n4",
      "type": "ending",
      "text": "Toute la famille s'assoit. Ava croque la tomate. Elle est fraîche. L'histoire est finie."
    }
  },
  "validation": {
    "status": "APPROVED_TEXT",
    "blocking_findings": 0,
    "major_findings": 0,
    "paths_tested": 1
  }
}
