{
  "tree_id": "ATOM-TMP.SEM.002-03",
  "kind": "atomic",
  "version": 1,
  "language": "fr",
  "age_band": "N2",
  "age_range": "4-5",
  "title": "Le mercredi de Rayan",
  "lesson_id": "TMP.SEM.002",
  "secondary_lessons": [],
  "domain": "TMP",
  "subdomain": "TMP.SEM",
  "framing": "standard",
  "sensitivity": "standard",
  "family_model": "father_mother_children",
  "setting": "cuisine",
  "characters": [
    "Rayan",
    "maman"
  ],
  "root_id": "n1",
  "duration_estimate_seconds": {
    "min": 120,
    "avg": 180,
    "max": 240
  },
  "nodes": {
    "n1": {
      "id": "n1",
      "type": "audio",
      "text": "Rayan est à la cuisine. Maman accroche un calendrier. Des aimants colorés tiennent les jours. Maman dit : lundi, mardi, jeudi, vendredi, c'est l'école. Mercredi, Rayan reste à la maison. Il joue avec maman. Ils font des crêpes. Ça sent le beurre. Samedi, Rayan reste aussi à la maison. Dimanche encore. Maman dit : samedi et dimanche, c'est le week-end. Rayan touche mercredi. Il range le cartable. Pas d'école ce jour-là. Il dessine un soleil. Parce que c'est mercredi, le cartable reste au crochet. Rayan dit : mercredi, samedi, dimanche, on est à la maison. Maman sourit. Parce que le week-end arrive, Rayan est content. Il répète : mercredi. Samedi. Dimanche. Les aimants restent sur le frigo.",
      "next": "n2"
    },
    "n2": {
      "id": "n2",
      "type": "question_lesson",
      "prompt": "Rayan est à la maison le mercredi. Quels autres jours aussi ?",
      "expected_intents": [
        "MERCREDI",
        "WEEKEND"
      ],
      "accepted_examples": [
        "samedi",
        "dimanche",
        "week-end",
        "mercredi",
        "samedi dimanche"
      ],
      "retry_prompt": "Samedi et dimanche, c'est le week-end. Quels jours ?",
      "positive_feedback": "Oui. Mercredi, samedi et dimanche, Rayan est à la maison.",
      "wrong_feedback": "Certains jours, c'est l'école. Mercredi, samedi et dimanche, on est à la maison.",
      "default_next": "n3",
      "next": "n3"
    },
    "n3": {
      "id": "n3",
      "type": "feedback",
      "text": "Rayan a nommé mercredi, samedi et dimanche. Ce sont des jours à la maison.",
      "next": "n4"
    },
    "n4": {
      "id": "n4",
      "type": "ending",
      "text": "Rayan pose son crayon. Les crêpes sont prêtes. L'histoire est finie."
    }
  },
  "validation": {
    "status": "APPROVED_TEXT",
    "blocking_findings": 0,
    "major_findings": 0,
    "paths_tested": 1
  }
}
