{
  "tree_id": "ATOM-REL.CON.001-03",
  "kind": "atomic",
  "version": 1,
  "language": "fr",
  "age_band": "N2",
  "age_range": "4-5",
  "title": "Inaya dit stop au parc",
  "lesson_id": "REL.CON.001",
  "secondary_lessons": [],
  "domain": "REL",
  "subdomain": "REL.CON",
  "framing": "standard",
  "sensitivity": "standard",
  "family_model": "father_mother_children",
  "setting": "parc",
  "characters": [
    "Inaya",
    "maman"
  ],
  "root_id": "n1",
  "duration_estimate_seconds": {
    "min": 120,
    "avg": 180,
    "max": 240
  },
  "nodes": {
    "n1": {
      "id": "n1",
      "type": "audio",
      "text": "Inaya est au parc avec maman. Maman s'assoit sur le banc. Inaya joue près des cerceaux. L'herbe est tiède. Un camarade court. Il bouscule Inaya. Inaya sent un choc. Son cœur bat vite. Inaya dit : stop. Elle fait un pas de côté. Elle doit s'éloigner. S'éloigner, c'est marcher vers maman. Inaya marche vers le banc. Maman est son parent au parc. Inaya rejoint son parent au parc. Elle dit : on m'a bousculée. Maman l'écoute. Maman dit : tu as dit stop. Tu t'es éloignée. Tu es venue vers moi. Parce qu'elle a dit stop, Inaya est près de maman. Inaya souffle doucement. Le banc est calme. Parce qu'elle s'est éloignée, elle peut raconter. Inaya reste près de son parent au parc.",
      "next": "n2"
    },
    "n2": {
      "id": "n2",
      "type": "question_lesson",
      "prompt": "Un camarade bouscule Inaya. Que fait-elle ?",
      "expected_intents": [
        "STOP",
        "ELOIGNER",
        "PARENT"
      ],
      "accepted_examples": [
        "stop",
        "s'éloigner",
        "vers maman",
        "le banc",
        "parent"
      ],
      "retry_prompt": "Elle dit stop. Elle va vers maman. Que fait Inaya ?",
      "positive_feedback": "Oui. Inaya dit stop. Elle s'éloigne. Elle rejoint son parent au parc.",
      "wrong_feedback": "On dit stop. On s'éloigne. On va vers papa ou maman, le parent au parc.",
      "default_next": "n3",
      "next": "n3"
    },
    "n3": {
      "id": "n3",
      "type": "feedback",
      "text": "Inaya a dit stop. Elle s'est éloignée. Elle a rejoint son parent au parc.",
      "next": "n4"
    },
    "n4": {
      "id": "n4",
      "type": "ending",
      "text": "Inaya tient la main de maman. Les oiseaux chantent. L'histoire est finie."
    }
  },
  "validation": {
    "status": "APPROVED_TEXT",
    "blocking_findings": 0,
    "major_findings": 0,
    "paths_tested": 1
  }
}
