{
  "tree_id": "ATOM-FAM.VER.001-01",
  "kind": "atomic",
  "version": 1,
  "language": "fr",
  "age_band": "N2",
  "age_range": "4-5",
  "title": "Inès raconte à maman",
  "lesson_id": "FAM.VER.001",
  "secondary_lessons": [],
  "domain": "FAM",
  "subdomain": "FAM.VER",
  "framing": "standard",
  "sensitivity": "standard",
  "family_model": "father_mother_children",
  "setting": "cuisine",
  "characters": [
    "Inès",
    "maman",
    "papa"
  ],
  "root_id": "n1",
  "duration_estimate_seconds": {
    "min": 120,
    "avg": 160,
    "max": 210
  },
  "nodes": {
    "n1": {
      "id": "n1",
      "type": "audio",
      "text": "Inès est dans la cuisine, près de maman. Maman coupe des pommes. Ça sent le fruit. Inès veut aider. Elle attrape le saladier. Le saladier glisse. La farine tombe. Ça fait un nuage blanc. Le sol est blanc. Inès a le ventre serré. Elle va vers maman. Inès dit : maman, le saladier est tombé. J'ai fait tomber la farine. Maman s'approche. Maman dit : merci de raconter. On ramasse ensemble. Inès prend la petite balayette. Maman tient la pelle. La farine revient dans le seau. Papa entre. Inès dit : papa, j'ai raconté. Le saladier est tombé. Papa écoute. Papa dit : merci Inès. On raconte à papa ou maman. C'est comme ça.",
      "next": "n2"
    },
    "n2": {
      "id": "n2",
      "type": "question_lesson",
      "prompt": "La farine est tombée. Que fait Inès ?",
      "expected_intents": [
        "RACONTER",
        "PAPA_MAMAN"
      ],
      "accepted_examples": [
        "raconter",
        "elle raconte",
        "à maman",
        "à papa"
      ],
      "retry_prompt": "Elle le dit à maman. Que fait Inès ?",
      "positive_feedback": "Oui. Inès raconte à maman ce qui s'est passé.",
      "wrong_feedback": "On raconte à papa ou maman ce qui s'est passé.",
      "default_next": "n3",
      "next": "n3"
    },
    "n3": {
      "id": "n3",
      "type": "feedback",
      "text": "Inès a raconté. Maman a écouté. Papa a écouté. Ensemble, ils ont ramassé. Raconter aide.",
      "next": "n4"
    },
    "n4": {
      "id": "n4",
      "type": "ending",
      "text": "Le sol est propre. Inès se lave les mains. Maman coupe encore une pomme. L'histoire est finie."
    }
  },
  "validation": {
    "status": "APPROVED_TEXT",
    "blocking_findings": 0,
    "major_findings": 0,
    "paths_tested": 1
  }
}
