{
  "tree_id": "ATOM-DIF.ENE.001-05",
  "kind": "atomic",
  "version": 1,
  "language": "fr",
  "age_band": "N1",
  "age_range": "3-4",
  "title": "Ulysse a de l'énergie",
  "lesson_id": "DIF.ENE.001",
  "secondary_lessons": [],
  "domain": "DIF",
  "subdomain": "DIF.ENE",
  "framing": "respect",
  "sensitivity": "standard",
  "family_model": "father_mother_children",
  "setting": "jardin",
  "characters": [
    "Tania",
    "Ulysse",
    "maman"
  ],
  "root_id": "n1",
  "duration_estimate_seconds": {
    "min": 90,
    "avg": 130,
    "max": 170
  },
  "nodes": {
    "n1": {
      "id": "n1",
      "type": "audio",
      "text": "Tania joue au jardin. Maman est près du bac. Ulysse arrive en sautant. Il a beaucoup d'énergie. Il tourne. Il s'arrête. Il recommence. Tania le regarde. Maman dit : beaucoup d'énergie, ce n'est pas une faute. On peut jouer. On peut attendre. On peut demander à un adulte. Tania hoche la tête. Elle dit : à tour de rôle. Ulysse attend. Puis Tania joue. Puis Ulysse joue. L'énergie est encore là. Ce n'est pas une faute. Ils jouent ensemble.",
      "next": "n2"
    },
    "n2": {
      "id": "n2",
      "type": "question_lesson",
      "prompt": "Ulysse a de l'énergie. Que peut-on faire ?",
      "expected_intents": [
        "JOUER",
        "ATTENDRE",
        "ADULTE"
      ],
      "accepted_examples": [
        "jouer",
        "attendre",
        "un adulte",
        "demander"
      ],
      "retry_prompt": "On peut jouer, attendre, ou demander à un adulte. Que fait-on ?",
      "positive_feedback": "Oui. L'énergie n'est pas une faute. On peut jouer ou attendre.",
      "wrong_feedback": "Beaucoup d'énergie, ce n'est pas une faute. On peut jouer ou attendre. On peut demander à un adulte.",
      "default_next": "n3",
      "next": "n3"
    },
    "n3": {
      "id": "n3",
      "type": "feedback",
      "text": "Ulysse a de l'énergie. Ce n'est pas une faute. Tania a joué. Elle a su attendre.",
      "next": "n4"
    },
    "n4": {
      "id": "n4",
      "type": "ending",
      "text": "Maman tend la main. Tania et Ulysse rangent le seau. L'histoire est finie."
    }
  },
  "validation": {
    "status": "APPROVED_TEXT",
    "blocking_findings": 0,
    "major_findings": 0,
    "paths_tested": 1
  }
}
