{
  "tree_id": "ATOM-EMO.LEX.002-04",
  "kind": "atomic",
  "version": 1,
  "language": "fr",
  "age_band": "N2",
  "age_range": "4-5",
  "title": "Mateo est triste pour sa tour",
  "lesson_id": "EMO.LEX.002",
  "secondary_lessons": [],
  "domain": "EMO",
  "subdomain": "EMO.LEX",
  "framing": "emotional",
  "sensitivity": "standard",
  "family_model": "father_mother_children",
  "setting": "salon",
  "characters": [
    "Mateo",
    "papa"
  ],
  "root_id": "n1",
  "duration_estimate_seconds": {
    "min": 120,
    "avg": 170,
    "max": 220
  },
  "nodes": {
    "n1": {
      "id": "n1",
      "type": "audio",
      "text": "Mateo construit une tour dans le salon. Les cubes sont bleus et jaunes. La tour est haute. Le chat passe. Les cubes tombent. Ils font un bruit sourd. Mateo sent sa gorge serrée. Ses yeux deviennent chauds. Une larme tombe. Mateo dit : je suis triste. Papa arrive près de lui. Papa dit : pleurer est permis. Mateo pleure un peu. Les larmes coulent. Puis Mateo dit : je veux un câlin. Papa ouvre les bras. Mateo se blottit contre papa. Le câlin est chaud. Parce que la tour est tombée, Mateo est triste. Être triste, c'est permis. Plus tard, papa pose un cube. Mateo pose un cube. Une petite tour recommence. Mateo souffle. Ses épaules se desserrent.",
      "next": "n2"
    },
    "n2": {
      "id": "n2",
      "type": "question_lesson",
      "prompt": "Mateo a les yeux chauds. Que dit-il ?",
      "expected_intents": [
        "TRISTE",
        "CALIN"
      ],
      "accepted_examples": [
        "triste",
        "je suis triste",
        "câlin",
        "un câlin",
        "pleurer"
      ],
      "retry_prompt": "Mateo peut demander un câlin. Que dit-il ?",
      "positive_feedback": "Oui. Mateo dit : je suis triste. Il demande un câlin.",
      "wrong_feedback": "On dit : je suis triste. On demande un câlin à papa ou maman. Pleurer est permis.",
      "default_next": "n3",
      "next": "n3"
    },
    "n3": {
      "id": "n3",
      "type": "feedback",
      "text": "Mateo a nommé : triste. Pleurer est permis. Un câlin de papa aide.",
      "next": "n4"
    },
    "n4": {
      "id": "n4",
      "type": "ending",
      "text": "Mateo pose un dernier cube. Papa reste près de lui. L'histoire est finie."
    }
  },
  "validation": {
    "status": "APPROVED_TEXT",
    "blocking_findings": 0,
    "major_findings": 0,
    "paths_tested": 1
  }
}
