{
  "tree_id": "ATOM-JEU.BAS.001-07",
  "kind": "atomic",
  "version": 1,
  "language": "fr",
  "age_band": "N3",
  "age_range": "5-6",
  "title": "Klara vise le panier au gymnase",
  "lesson_id": "JEU.BAS.001",
  "secondary_lessons": [],
  "domain": "JEU",
  "subdomain": "JEU.BAL",
  "framing": "standard",
  "sensitivity": "standard",
  "family_model": "father_mother_children",
  "setting": "gymnase",
  "characters": [
    "Klara",
    "papa"
  ],
  "root_id": "n1",
  "duration_estimate_seconds": {
    "min": 130,
    "avg": 190,
    "max": 240
  },
  "nodes": {
    "n1": {
      "id": "n1",
      "type": "audio",
      "text": "Klara et papa sont au gymnase. Un petit panier est accroché bas. Papa donne le ballon. Papa dit : on va passer le ballon. Ensuite, chacun a un lancer. Klara passe. Papa rend. C'est le lancer de Klara. Elle lance vers le panier. Le ballon rentre. Papa a son lancer. Klara dit : chacun un lancer. Ils se passent encore le ballon.",
      "next": "n2"
    },
    "n2": {
      "id": "n2",
      "type": "question_lesson",
      "prompt": "Klara joue au basket. Que fait-elle ?",
      "expected_intents": [
        "PANIER",
        "PASSER"
      ],
      "accepted_examples": [
        "le panier",
        "passer",
        "lancer",
        "au panier"
      ],
      "retry_prompt": "Elle lance le ballon. Vers quoi ?",
      "positive_feedback": "Oui. Elle passe. Elle lance au panier. Chacun a un lancer.",
      "wrong_feedback": "On se passe le ballon. On lance au panier. Chacun a un lancer.",
      "default_next": "n3",
      "next": "n3",
      "lesson_id": "JEU.BAS.001"
    },
    "n3": {
      "id": "n3",
      "type": "feedback",
      "text": "Klara a passé le ballon. Elle a visé le panier. Chacun a eu un lancer.",
      "next": "n4"
    },
    "n4": {
      "id": "n4",
      "type": "ending",
      "text": "Papa range le ballon. Klara essuie ses mains. L'histoire est finie."
    }
  },
  "validation": {
    "status": "APPROVED_TEXT",
    "blocking_findings": 0,
    "major_findings": 0,
    "paths_tested": 1
  }
}
