{
  "tree_id": "ATOM-FAM.SEC.002-05",
  "kind": "atomic",
  "version": 1,
  "language": "fr",
  "age_band": "N3",
  "age_range": "5-6",
  "title": "Cédric raconte ce qui fait peur",
  "lesson_id": "FAM.SEC.002",
  "secondary_lessons": [],
  "domain": "FAM",
  "subdomain": "FAM.SEC",
  "framing": "standard",
  "sensitivity": "enhanced",
  "family_model": "father_mother_children",
  "setting": "parc puis maison",
  "characters": [
    "Cédric",
    "papa",
    "maman"
  ],
  "root_id": "n1",
  "duration_estimate_seconds": {
    "min": 130,
    "avg": 185,
    "max": 235
  },
  "nodes": {
    "n1": {
      "id": "n1",
      "type": "audio",
      "text": "Cédric est au parc avec papa. Il sent l'herbe. Un adulte parle tout bas. Il dit : c'est notre secret. Cédric sent son ventre. C'est serré. C'est un malaise. Cédric a peur. Cédric marche vers papa. Il prend sa main. Cédric dit : papa, un adulte a parlé d'un secret. Mon ventre est serré. J'ai peur. Papa l'écoute. Papa dit : merci de raconter. Tu as le droit de le dire. Ce qui fait peur se raconte. On va raconter à papa ou maman. Plus tard, à la maison, Cédric le dit aussi à maman. Maman écoute. Cédric se sent plus léger. Même leçon, autre lieu. Peur ou malaise, on raconte à papa ou maman.",
      "next": "n2"
    },
    "n2": {
      "id": "n2",
      "type": "question_lesson",
      "prompt": "Cédric a peur. Que fait-il ?",
      "expected_intents": [
        "RACONTER",
        "PAPA_MAMAN"
      ],
      "accepted_examples": [
        "raconter",
        "le dire",
        "à papa",
        "à maman"
      ],
      "retry_prompt": "Il va le dire à papa. Que fait Cédric ?",
      "positive_feedback": "Oui. Cédric raconte à papa. Ce qui fait peur se dit.",
      "wrong_feedback": "Quand on a peur, on va raconter à papa ou maman.",
      "default_next": "n3",
      "next": "n3"
    },
    "n3": {
      "id": "n3",
      "type": "feedback",
      "text": "Cédric a senti le malaise. Il a marché vers papa. Il a raconté. Papa et maman écoutent. Ce qui fait peur se raconte.",
      "next": "n4"
    },
    "n4": {
      "id": "n4",
      "type": "ending",
      "text": "Cédric s'assoit près de maman. Papa est là aussi. Sa main est chaude. L'histoire est finie."
    }
  },
  "validation": {
    "status": "APPROVED_TEXT",
    "blocking_findings": 0,
    "notes": "générateur, revue humaine requise",
    "major_findings": 0,
    "paths_tested": 1
  }
}
